{
  "$schema": "./recipe.schema.json",
  "comment": "R-em3d24-4b. openEMS publishes no macOS binary, so this runs upstream's build script as F0 did (row 11 of testdata/em3d/f0/README.md §Install). 0.37.0 final (2026-10-09) replaced the release candidate in brief-sar-1.",
  "id": "openems-0.37.0-macos-arm64",
  "tool": "openems",
  "version": "0.37.0",
  "platform": "macos",
  "architecture": "arm64",
  "layout": "in-place",
  "layoutNote": "Built from source by upstream's own script with an absolute install prefix, which CMake writes into the libraries' paths: it cannot be moved after it is built, so the home is built in place and published by writing its record last.",
  "needsSpaceFreePath": true,
  "sources": [
    {
      "id": "openems",
      "url": "https://github.com/thliebig/openEMS-Project.git",
      "fetchedBy": "git",
      "checksumNote": "a git clone of tag v0.37.0, checked against its commit 974294ba7d812ef5a46a4760593057aee7ce6866 after the clone"
    },
    {
      "url": "https://github.com/thliebig/CSXCAD.git",
      "fetchedBy": "git (a submodule)",
      "checksumNote": "cloned at the commit the tagged project pins"
    },
    {
      "url": "https://github.com/thliebig/openEMS.git",
      "fetchedBy": "git (a submodule)",
      "checksumNote": "cloned at the commit the tagged project pins"
    },
    {
      "url": "https://github.com/thliebig/fparser.git",
      "fetchedBy": "git (a submodule)",
      "checksumNote": "cloned at the commit the tagged project pins"
    },
    {
      "url": "https://github.com/thliebig/QCSXCAD.git",
      "fetchedBy": "git (a submodule; not built with --disable-GUI)",
      "checksumNote": "cloned at the commit the tagged project pins"
    },
    {
      "url": "https://github.com/thliebig/AppCSXCAD.git",
      "fetchedBy": "git (a submodule; not built with --disable-GUI)",
      "checksumNote": "cloned at the commit the tagged project pins"
    },
    {
      "url": "https://github.com/thliebig/CTB.git",
      "fetchedBy": "git (a submodule; not built)",
      "checksumNote": "cloned at the commit the tagged project pins"
    },
    {
      "url": "https://github.com/koendv/hyp2mat.git",
      "fetchedBy": "git (a submodule; not built)",
      "checksumNote": "cloned at the commit the tagged project pins"
    },
    {
      "url": "https://sourceforge.net/projects/tinyxml/files/tinyxml/2.6.2/tinyxml_2_6_2.tar.gz",
      "fetchedBy": "openEMS's build script (TinyXML, built from source on macOS)",
      "checksumNote": "checked by upstream's own build script against the SHA-256 written in it"
    },
    {
      "url": "https://raw.githubusercontent.com/alpinelinux/aports/b1ff376e83eb49c0127b039b3684eccdf9a60694/community/tinyxml/",
      "fetchedBy": "openEMS's build script (four TinyXML patches)",
      "checksumNote": "checked by upstream's own build script against the SHA-256 written in it"
    },
    {
      "url": "https://gist.githubusercontent.com/scpeters/6325123/raw/cfb079be67997cb19a1aee60449714a1dedefed5/tinyxml_CMakeLists.patch",
      "fetchedBy": "openEMS's build script (TinyXML's CMake patch)",
      "checksumNote": "checked by upstream's own build script against the SHA-256 written in it"
    }
  ],
  "prerequisites": [
    {
      "kind": "command",
      "name": "Apple's command-line developer tools",
      "path": "/usr/bin/xcode-select",
      "arguments": [
        "-p"
      ],
      "remedy": {
        "default": "xcode-select --install"
      }
    },
    {
      "kind": "program",
      "name": "git",
      "search": [
        "/opt/homebrew/bin",
        "/usr/bin"
      ],
      "variable": "git",
      "remedy": {
        "default": "xcode-select --install"
      }
    },
    {
      "kind": "file",
      "name": "Homebrew",
      "path": "/opt/homebrew/bin/brew",
      "remedy": {
        "default": "/bin/bash -c \"$(curl -fsSL https://raw.githubusercontent.com/Homebrew/install/HEAD/install.sh)\"   # Homebrew's own installer, from https://brew.sh"
      }
    },
    {
      "kind": "file",
      "name": "Homebrew's vtk",
      "path": "/opt/homebrew/opt/vtk",
      "remedy": {
        "default": "brew install cmake boost hdf5 cgal vtk"
      }
    },
    {
      "kind": "file",
      "name": "Homebrew's cmake",
      "path": "/opt/homebrew/opt/cmake/bin/cmake",
      "remedy": {
        "default": "brew install cmake boost hdf5 cgal vtk"
      }
    },
    {
      "kind": "file",
      "name": "Homebrew's boost",
      "path": "/opt/homebrew/opt/boost/include/boost/version.hpp",
      "remedy": {
        "default": "brew install cmake boost hdf5 cgal vtk"
      }
    },
    {
      "kind": "file",
      "name": "Homebrew's hdf5",
      "path": "/opt/homebrew/opt/hdf5/include/hdf5.h",
      "remedy": {
        "default": "brew install cmake boost hdf5 cgal vtk"
      }
    },
    {
      "kind": "file",
      "name": "Homebrew's cgal",
      "path": "/opt/homebrew/opt/cgal/include/CGAL/version.h",
      "remedy": {
        "default": "brew install cmake boost hdf5 cgal vtk"
      }
    }
  ],
  "environment": {
    "PATH": "/opt/homebrew/bin:/usr/bin:/bin:/usr/sbin:/sbin"
  },
  "clearEnvironment": [
    "PYTHONPATH",
    "PYTHONHOME",
    "CMAKE_PREFIX_PATH"
  ],
  "steps": [
    {
      "name": "Clone openEMS 0.37.0",
      "kind": "run",
      "command": "${git}",
      "arguments": [
        "clone",
        "--quiet",
        "--recursive",
        "--branch",
        "v0.37.0",
        "https://github.com/thliebig/openEMS-Project.git",
        "${home}/src"
      ]
    },
    {
      "name": "Check openEMS's commit",
      "kind": "run",
      "command": "${git}",
      "arguments": [
        "-C",
        "${home}/src",
        "rev-parse",
        "HEAD"
      ],
      "captureAs": "openems",
      "expect": "974294ba7d812ef5a46a4760593057aee7ce6866"
    },
    {
      "name": "Make the build script run on macOS's bash",
      "kind": "run",
      "command": "/usr/bin/sed",
      "arguments": [
        "-i",
        "",
        "-e",
        "243s/\"\\${PYTHON_ARGS\\[\\*\\]}\"/\"${PYTHON_ARGS[*]+${PYTHON_ARGS[*]}}\"/",
        "update_openEMS.sh"
      ],
      "workingDirectory": "${home}/src",
      "comment": "macOS ships bash 3.2, which under the script's 'set -u' calls an empty array unbound (bash 4.4 does not), and the array is empty because this recipe does not pass --python: the run stopped at line 243 with 'PYTHON_ARGS[*]: unbound variable'. The guarded spelling is the one the script itself uses everywhere else, gives the same answer on every bash, and needs nothing installed. It is the only expansion on this recipe's path that bash 3.2 refuses."
    },
    {
      "name": "Check the build script's patched line",
      "kind": "run",
      "command": "/usr/bin/sed",
      "arguments": [
        "-n",
        "243p",
        "update_openEMS.sh"
      ],
      "workingDirectory": "${home}/src",
      "captureAs": "patchedLine",
      "expect": "if [ \"$BUILD_PY_EXT\" -eq 0 ] && [ -n \"${PYTHON_ARGS[*]+${PYTHON_ARGS[*]}}\" ]; then",
      "comment": "sed exits 0 when its pattern matches nothing, so the edit is checked rather than trusted"
    },
    {
      "name": "Build openEMS",
      "kind": "run",
      "command": "${home}/src/update_openEMS.sh",
      "arguments": [
        "${home}",
        "--disable-GUI",
        "--njobs=${jobs}"
      ],
      "workingDirectory": "${home}/src",
      "comment": "upstream's own build script, started by its path with an argument list, exactly as F0 ran it but without --python"
    }
  ],
  "program": "${home}/bin/openEMS",
  "measured": {
    "minutes": 8,
    "diskGB": 0.27,
    "source": "macOS 27.0 on an Apple M4, 2026-10-17 (brief-sar-1): 2 min 17 s of build after the Homebrew dependencies, 151 MB installed; the release candidate's F0 build took 2 min 43 s and 116 MB of source (testdata/em3d/f0/README.md §Install, rows 10-11)"
  },
  "knownFailures": [
    "autotools-path-has-space"
  ]
}
